# repo	stage	source_repo	source_paths	visibility	role	depends_on	pro_extension
pk-shared	1	platformkit-shared	composition,fieldmeta,flowdef,observability,presentation,registry,standards,statemachine,sync,tokens	public	Small shared contracts and cross-repo vocabulary		Private-only schemas stay in Pro repos
pk-core	1	platformkit-backend-kit	app/module,app/application,core,infrastructure/config,observability,resilience,security	public	Backend/module framework core: modules, catalogs, composition, config, lifecycle, auth hooks, observability	pk-shared	Pro adds providers, adapters, and deployment-specific runtime extensions
pk-client	2	platformkit-backend-kit	client	public	Public transport-agnostic client and SDK primitives	pk-shared	Pro adds generated SDKs, hosted auth defaults, and private telemetry
pk-design	2	platformkit-design-system	adapters,experiences,moduletokens,overlays,pkds,themes,tokens,tw	public	Token-authored design system and design export adapters	pk-shared	Pro adds private brand systems and provider adapters
pk-tools	2	platformkit-devtools	cmd/platformkit,platformkit/cmd,platformkit/cli,platformkit/contractcheck	public	Composable CLI and terminal UX foundation for PlatformKit	pk-shared	Pro adds private ops, cloud, release, client, and enterprise commands
pk-modules	3	platformkit-business-modules	tenant_management,user_management,auth_management,admin_management,api_key_management,audit_management,health_management,entitlement_management,notification_management,mail_management,content_management,site_management,ports,catalog,moduledescriptor,proxies,testutil	public	OSS essential module pack	pk-core,pk-design,pk-shared	Pro adds paid/vertical module packs
pk-apps	4	platformkit-apps	complete-saas-monolith,modulecatalog,scenarios	public	Minimal runnable apps and examples	pk-core,pk-modules,pk-design,pk-shared	Pro forks/adds private app distributions and hosted deployment topology
pk-docs	5	platformkit-docs	adr,architecture,requirements,docs,apps,packages,scripts,.platformkit,antora-playbook.yml,antora-ui,schemas	public	Public PlatformKit docs source, ADRs, requirements, docs composer, and base PlatformKit page renderer	pk-core,pk-client,pk-modules,pk-design,pk-shared,pk-tools	Renderer consumes public-safe overlay content from septagon-clients/platformkit; private live-publish workflows stay downstream
